{
  "schema": "sip-ai.model_manifest.v1",
  "model_id": "llama-3.2-3b-instruct-gguf-q4_k_m",
  "display_name": "Llama 3.2 3B Instruct GGUF Q4_K_M",
  "source_repo": "huggingface:bartowski/Llama-3.2-3B-Instruct-GGUF",
  "weights_hash": "sha256:0000000000000000000000000000000000000000000000000000000000000000",
  "format": "GGUF",
  "quantization": "Q4_K_M",
  "license": "llama3.2",
  "commercial_use": true,
  "recommended_runtimes": ["ollama", "llama.cpp"],
  "min_memory_gb": 4,
  "recommended_memory_gb": 8,
  "context_tested": [4096, 8192, 16384],
  "tasks": ["general-chat", "reasoning", "rag"],
  "manifest_uri": "arweave://PLACEHOLDER_TX_ID"
}
