{
  "schema": "sip-ai.model_manifest.v1",
  "model_id": "qwen2.5-0.5b-instruct-gguf-q4_k_m",
  "display_name": "Qwen2.5 0.5B Instruct GGUF Q4_K_M",
  "source_repo": "huggingface:Qwen/Qwen2.5-0.5B-Instruct-GGUF",
  "weights_hash": "sha256:0000000000000000000000000000000000000000000000000000000000000000",
  "format": "GGUF",
  "quantization": "Q4_K_M",
  "license": "apache-2.0",
  "commercial_use": true,
  "recommended_runtimes": ["ollama", "llama.cpp"],
  "min_memory_gb": 1,
  "recommended_memory_gb": 2,
  "context_tested": [2048, 4096, 8192],
  "tasks": ["general-chat", "rag"],
  "manifest_uri": "arweave://PLACEHOLDER_TX_ID"
}
